{
  "schema_version": 1,
  "content_id": "rule_equipment_pc_zone",
  "category": "rules",
  "kind": "policy_rule",
  "lifecycle": {
    "status": "published",
    "version": 1
  },
  "aliases": {
    "th": [
      "pc zone.*อุปกรณ์",
      "pc zone.*เก้าอี้",
      "pc zone.*เมาส์",
      "pc zone.*หูฟัง",
      "เก้าอี้เกมมิ่ง.*pc",
      "เมาส์.*หูฟัง"
    ],
    "en": [
      "gaming chair",
      "gaming mouse",
      "gaming headset"
    ]
  },
  "facts": {
    "route_category": "equipment",
    "intent": "pc_zone_equipment",
    "patterns": [
      "pc zone.*อุปกรณ์",
      "pc zone.*เก้าอี้",
      "pc zone.*เมาส์",
      "pc zone.*หูฟัง",
      "เก้าอี้เกมมิ่ง.*pc",
      "เมาส์.*หูฟัง",
      "gaming chair",
      "gaming mouse",
      "gaming headset"
    ],
    "priority": 128
  },
  "locales": {
    "th": {
      "status": "source",
      "fields": {
        "answer": "ใน PC Zone มี Gaming Monitor 10 Units, Gaming Chair 10 Units, Gaming Keyboard, Gaming Headset, Gaming Mouse และ Gaming PC รุ่น MSI MAG Infinite S3 14th 10 Units"
      }
    },
    "en": {
      "status": "legacy_unreviewed",
      "fields": {
        "answer": "The PC Zone has 10 Gaming Monitors, 10 Gaming Chairs, Gaming Keyboards, Gaming Headsets, Gaming Mice, and 10 MSI MAG Infinite S3 14th Gaming PCs."
      },
      "source_sha256": "b287c06c28d0edb71abbb8fccb49d50ef3f5292e1fbd81e2c1fbd446e0f8f580",
      "approved_by": "",
      "approved_at": ""
    }
  },
  "source": {
    "path": "data/rules/equipment_rules.jsonl",
    "url": "https://esports.phuket.psu.ac.th/home",
    "source_ids": [
      "home",
      "curated_home_equipment_pc_zone"
    ],
    "last_verified_at": ""
  }
}
