{
  "schema_version": 1,
  "content_id": "curated_user_info_required",
  "category": "knowledge",
  "kind": "knowledge_fact",
  "lifecycle": {
    "status": "published",
    "version": 1
  },
  "aliases": {
    "th": [
      "ข้อมูลที่ต้องกรอกตอนจอง"
    ],
    "en": []
  },
  "facts": {
    "source_url": "https://esports.computing.psu.ac.th/",
    "tags": [
      "booking",
      "user info",
      "กรอกข้อมูล"
    ],
    "priority": 9
  },
  "locales": {
    "th": {
      "status": "source",
      "fields": {
        "title": "ข้อมูลที่ต้องกรอกตอนจอง",
        "text": "ข้อมูลที่ต้องกรอกตอนจองประกอบด้วย Student ID/Staff ID/National ID ชื่อ นามสกุล อีเมล เบอร์โทรศัพท์ และคอมเมนต์ถ้ามี"
      }
    },
    "en": {
      "status": "missing",
      "fields": {},
      "source_sha256": "3f90e637992d39f271c57c2edda76091706c923e0e18465698c2091f94cb06fc",
      "approved_by": "",
      "approved_at": ""
    }
  },
  "source": {
    "path": "data/curated/curated_facts.jsonl",
    "url": "https://esports.computing.psu.ac.th/",
    "source_ids": [],
    "last_verified_at": ""
  }
}
