{
  "schema_version": 1,
  "content_id": "game_detail_naruto_x_boruto",
  "category": "games",
  "kind": "game_profile",
  "lifecycle": {
    "status": "published",
    "version": 1
  },
  "aliases": {
    "th": [
      "นารูโตะ",
      "โบรูโตะ"
    ],
    "en": [
      "naruto x boruto",
      "ultimate ninja storm connections",
      "naruto",
      "boruto",
      "NARUTO X BORUTO Ultimate Ninja Storm Connections"
    ]
  },
  "facts": {
    "text": "NARUTO X BORUTO Ultimate Ninja Storm Connections: NARUTO X BORUTO Ultimate Ninja Storm Connections คือเกมต่อสู้ที่ใช้ตัวละครจากจักรวาล Naruto/Boruto\nแนวเกม: เกมต่อสู้จากอนิเมะ\nวิธีเล่นโดยสรุป: เลือกตัวละคร ใช้คอมโบ สกิลนินจา และจังหวะหลบ/สวนกลับเพื่อเอาชนะคู่ต่อสู้\nเล่นได้ที่: PlayStation 5 Zone",
    "game": "NARUTO X BORUTO Ultimate Ninja Storm Connections",
    "zones": [
      "PlayStation 5 Zone"
    ],
    "tags": [
      "games",
      "game_detail",
      "naruto_x_boruto",
      "NARUTO X BORUTO Ultimate Ninja Storm Connections",
      "naruto x boruto",
      "ultimate ninja storm connections",
      "naruto",
      "boruto",
      "นารูโตะ",
      "โบรูโตะ"
    ],
    "source_url": "https://esports.phuket.psu.ac.th/Services/our-games",
    "priority": 20
  },
  "locales": {
    "th": {
      "status": "source",
      "fields": {
        "title": "NARUTO X BORUTO Ultimate Ninja Storm Connections",
        "summary_th": "NARUTO X BORUTO Ultimate Ninja Storm Connections คือเกมต่อสู้ที่ใช้ตัวละครจากจักรวาล Naruto/Boruto",
        "how_to_play_th": "เลือกตัวละคร ใช้คอมโบ สกิลนินจา และจังหวะหลบ/สวนกลับเพื่อเอาชนะคู่ต่อสู้",
        "genre": "เกมต่อสู้จากอนิเมะ"
      }
    },
    "en": {
      "status": "missing",
      "fields": {},
      "source_sha256": "1c22090579cde0321ff303b2a3cd782928230dcac4ffdce1d049b81e89cab6c7",
      "approved_by": "",
      "approved_at": ""
    }
  },
  "source": {
    "path": "data/curated/game_item_details.jsonl",
    "url": "https://esports.phuket.psu.ac.th/Services/our-games",
    "source_ids": [],
    "last_verified_at": ""
  }
}
