{
  "schema_version": 1,
  "content_id": "game_detail_ea_sports_fc_24",
  "category": "games",
  "kind": "game_profile",
  "lifecycle": {
    "status": "published",
    "version": 1
  },
  "aliases": {
    "th": [
      "เกมบอล"
    ],
    "en": [
      "ea sports fc 24",
      "fc 24",
      "fifa",
      "EA Sports FC 24"
    ]
  },
  "facts": {
    "text": "EA Sports FC 24: EA Sports FC 24 คือเกมฟุตบอลที่ให้ผู้เล่นควบคุมทีม แข่งขัน ยิงประตู และวางแผนเกมเหมือนการแข่งขันฟุตบอล\nแนวเกม: เกมฟุตบอล\nวิธีเล่นโดยสรุป: เลือกทีม จัดตัว ควบคุมการส่งบอล เลี้ยง ยิง และตั้งรับเพื่อทำประตูให้มากกว่าคู่แข่ง\nเล่นได้ที่: PlayStation 5 Zone",
    "game": "EA Sports FC 24",
    "zones": [
      "PlayStation 5 Zone"
    ],
    "tags": [
      "games",
      "game_detail",
      "ea_sports_fc_24",
      "EA Sports FC 24",
      "ea sports fc 24",
      "fc 24",
      "fifa",
      "เกมบอล"
    ],
    "source_url": "https://esports.phuket.psu.ac.th/Services/our-games",
    "priority": 20
  },
  "locales": {
    "th": {
      "status": "source",
      "fields": {
        "title": "EA Sports FC 24",
        "summary_th": "EA Sports FC 24 คือเกมฟุตบอลที่ให้ผู้เล่นควบคุมทีม แข่งขัน ยิงประตู และวางแผนเกมเหมือนการแข่งขันฟุตบอล",
        "how_to_play_th": "เลือกทีม จัดตัว ควบคุมการส่งบอล เลี้ยง ยิง และตั้งรับเพื่อทำประตูให้มากกว่าคู่แข่ง",
        "genre": "เกมฟุตบอล"
      }
    },
    "en": {
      "status": "missing",
      "fields": {},
      "source_sha256": "fef7ad0e97d5817026727691e52376e65a8d4f304a3fdeff3dbd333f498bafe9",
      "approved_by": "",
      "approved_at": ""
    }
  },
  "source": {
    "path": "data/curated/game_item_details.jsonl",
    "url": "https://esports.phuket.psu.ac.th/Services/our-games",
    "source_ids": [],
    "last_verified_at": ""
  }
}
