{
  "schema_version": 1,
  "content_id": "availability_ps5_01_02",
  "category": "resources",
  "kind": "service_availability",
  "lifecycle": {
    "status": "published",
    "version": 1
  },
  "aliases": {
    "th": [],
    "en": [
      "PlayStation 5 Zone",
      "PlayStation 5 #01-#02",
      "Call of Duty: Modern Warfare III",
      "Delta Force",
      "EA Sports FC 24",
      "eFootball",
      "FINAL FANTASY XVI",
      "Fortnite",
      "God of War Ragnarok",
      "Hogwarts Legacy",
      "Marvel's Spider-Man 2",
      "NARUTO X BORUTO Ultimate Ninja Storm Connections",
      "Resident Evil 4",
      "Resident Evil Village",
      "TEKKEN 8",
      "THE FINALS",
      "The Last of Us Part I",
      "The Last of Us Part II (Remastered)",
      "Uncharted: Legacy of Thieves Collection"
    ]
  },
  "facts": {
    "zone": "PlayStation 5 Zone",
    "service_label": "PlayStation 5 #01-#02",
    "machine_label": "PlayStation 5 #01-#02",
    "machine_numbers": [
      1,
      2
    ],
    "duration_minutes": 60,
    "capacity_persons": "1-2 คน",
    "games": [
      "Call of Duty: Modern Warfare III",
      "Delta Force",
      "EA Sports FC 24",
      "eFootball",
      "FINAL FANTASY XVI",
      "Fortnite",
      "God of War Ragnarok",
      "Hogwarts Legacy",
      "Marvel's Spider-Man 2",
      "NARUTO X BORUTO Ultimate Ninja Storm Connections",
      "Resident Evil 4",
      "Resident Evil Village",
      "TEKKEN 8",
      "THE FINALS",
      "The Last of Us Part I",
      "The Last of Us Part II (Remastered)",
      "Uncharted: Legacy of Thieves Collection"
    ],
    "source_url": "https://esports.computing.psu.ac.th/",
    "source_ids": [
      "official_reservation_page_20260730",
      "user_confirmed_screenshot_20260730"
    ],
    "last_verified_at": "2026-07-30",
    "verified_by": "official reservation page and user-provided screenshot"
  },
  "locales": {
    "th": {
      "status": "source",
      "fields": {
        "notes": [
          "PlayStation 5 #01 และ #02 ใช้รายการเกมเดียวกัน"
        ]
      }
    },
    "en": {
      "status": "missing",
      "fields": {},
      "source_sha256": "460669a20f4baf3e0bffd9ce2cd2182ac8a139ecf06bccb5cd083cf5b386c523",
      "approved_by": "",
      "approved_at": ""
    }
  },
  "source": {
    "path": "data/curated/service_game_availability.jsonl",
    "url": "https://esports.computing.psu.ac.th/",
    "source_ids": [
      "official_reservation_page_20260730",
      "user_confirmed_screenshot_20260730"
    ],
    "last_verified_at": "2026-07-30"
  }
}
