{
  "schema_version": 1,
  "content_id": "controls.ps5.final_fantasy_xvi",
  "category": "game_controls",
  "kind": "control_map",
  "lifecycle": {
    "status": "published",
    "version": 1
  },
  "aliases": {
    "th": [
      "ไฟนอลแฟนตาซี 16",
      "ไฟนอล 16",
      "ไฟนอลสิบหก",
      "ไฟนอลแฟนตาซีสิบหก",
      "ไฟนอล",
      "ไฟนอ",
      "ไฟนอแฟนตาซี 16",
      "ไฟนอนแฟนตาซี",
      "ไฟนอน 16",
      "ไฟนอนสิบหก",
      "ไฟนอแฟนตาซีสิบหก",
      "ไฟนอนแฟนตาซีสิบหก"
    ],
    "en": [
      "FINAL FANTASY XVI",
      "FF16",
      "FFXVI",
      "Final fantasy 16"
    ]
  },
  "facts": {
    "game": "FINAL FANTASY XVI",
    "platform": "PlayStation / PS5",
    "platform_key": "ps5",
    "coverage_status": "secondary_needs_manual_verify",
    "control_count": 18,
    "source_urls": [
      "https://gamewith.net/final-fantasy-16/article/show/39644",
      "https://jegged.com/Games/Final-Fantasy-XVI/Tips-and-Tricks/Basic/Controls.html",
      "https://www.playstation.com/en-us/games/final-fantasy-xvi/everything-you-need-to-know-about-final-fantasy-xvi/"
    ]
  },
  "locales": {
    "th": {
      "status": "source",
      "fields": {
        "summary": "FINAL FANTASY XVI บน PlayStation / PS5 มีข้อมูลปุ่มควบคุม 18 รายการ\nหมายเหตุ: Updated from incorrect FINAL FANTASY XV controls to FINAL FANTASY XVI Type A controls. Cross-checked with GameWith and Jegged; please verify on the studio PS5 before marking complete.",
        "controls": [
          {
            "button": "Left Stick",
            "buttons": [
              "Left Stick"
            ],
            "action_th": "เคลื่อนที่",
            "description_th": "",
            "section": ""
          },
          {
            "button": "Right Stick",
            "buttons": [
              "Right Stick"
            ],
            "action_th": "ควบคุมมุมกล้อง",
            "description_th": "",
            "section": ""
          },
          {
            "button": "Square",
            "buttons": [
              "Square"
            ],
            "action_th": "โจมตีด้วยดาบ / โจมตีระยะประชิด",
            "description_th": "",
            "section": ""
          },
          {
            "button": "Triangle",
            "buttons": [
              "Triangle"
            ],
            "action_th": "โจมตีเวทมนตร์",
            "description_th": "",
            "section": ""
          },
          {
            "button": "Cross",
            "buttons": [
              "Cross"
            ],
            "action_th": "กระโดด",
            "description_th": "",
            "section": ""
          },
          {
            "button": "Circle",
            "buttons": [
              "Circle"
            ],
            "action_th": "ใช้ Eikonic Feat",
            "description_th": "",
            "section": ""
          },
          {
            "button": "R1",
            "buttons": [
              "R1"
            ],
            "action_th": "หลบหลีก",
            "description_th": "",
            "section": ""
          },
          {
            "button": "R2",
            "buttons": [
              "R2"
            ],
            "action_th": "เปิดชุด Eikonic Abilities",
            "description_th": "",
            "section": ""
          },
          {
            "button": "R2 + Square / Triangle / Cross / Circle",
            "buttons": [
              "R2 + Square / Triangle / Cross / Circle"
            ],
            "action_th": "ใช้ Eikonic Ability ที่ผูกไว้",
            "description_th": "",
            "section": ""
          },
          {
            "button": "L1",
            "buttons": [
              "L1"
            ],
            "action_th": "ล็อกเป้าหมาย",
            "description_th": "",
            "section": ""
          },
          {
            "button": "L2",
            "buttons": [
              "L2"
            ],
            "action_th": "สลับ Eikon",
            "description_th": "",
            "section": ""
          },
          {
            "button": "L3",
            "buttons": [
              "L3"
            ],
            "action_th": "Animal Instinct",
            "description_th": "",
            "section": ""
          },
          {
            "button": "R3",
            "buttons": [
              "R3"
            ],
            "action_th": "รีเซ็ตมุมกล้อง",
            "description_th": "",
            "section": ""
          },
          {
            "button": "L3 + R3",
            "buttons": [
              "L3 + R3"
            ],
            "action_th": "ใช้ Limit Break",
            "description_th": "",
            "section": ""
          },
          {
            "button": "Directional Buttons Up / Right / Down",
            "buttons": [
              "Directional Buttons Up / Right / Down"
            ],
            "action_th": "ทางลัดไอเทมหรือคำสั่ง Torgal",
            "description_th": "",
            "section": ""
          },
          {
            "button": "Directional Button Left",
            "buttons": [
              "Directional Button Left"
            ],
            "action_th": "สลับระหว่างไอเทมกับคำสั่ง Torgal",
            "description_th": "",
            "section": ""
          },
          {
            "button": "Options",
            "buttons": [
              "Options"
            ],
            "action_th": "เปิดเมนูหลัก / หยุดเกม",
            "description_th": "",
            "section": ""
          },
          {
            "button": "R2 + Touch Pad",
            "buttons": [
              "R2 + Touch Pad"
            ],
            "action_th": "ยั่วยุ",
            "description_th": "",
            "section": ""
          }
        ]
      }
    },
    "en": {
      "status": "legacy_unreviewed",
      "fields": {
        "controls": [
          {
            "button": "Left Stick",
            "action": "Move"
          },
          {
            "button": "Right Stick",
            "action": "Camera Movement"
          },
          {
            "button": "Square",
            "action": "Melee / Sword Attack"
          },
          {
            "button": "Triangle",
            "action": "Magic Attack"
          },
          {
            "button": "Cross",
            "action": "Jump"
          },
          {
            "button": "Circle",
            "action": "Eikonic Feat"
          },
          {
            "button": "R1",
            "action": "Evade"
          },
          {
            "button": "R2",
            "action": "Ready Eikonic Abilities"
          },
          {
            "button": "R2 + Square / Triangle / Cross / Circle",
            "action": "Use Eikonic Ability"
          },
          {
            "button": "L1",
            "action": "Lock On"
          },
          {
            "button": "L2",
            "action": "Cycle / Switch Eikons"
          },
          {
            "button": "L3",
            "action": "Animal Instinct"
          },
          {
            "button": "R3",
            "action": "Reset Camera"
          },
          {
            "button": "L3 + R3",
            "action": "Limit Break"
          },
          {
            "button": "Directional Buttons Up / Right / Down",
            "action": "Item Shortcuts / Torgal Commands"
          },
          {
            "button": "Directional Button Left",
            "action": "Switch Items and Torgal Commands"
          },
          {
            "button": "Options",
            "action": "Main Menu / Pause"
          },
          {
            "button": "R2 + Touch Pad",
            "action": "Taunt"
          }
        ]
      },
      "source_sha256": "799897e4483949430bb33cfdba89139b4ffa3bad133bdc9e1a02b395496a5927",
      "approved_by": "",
      "approved_at": ""
    }
  },
  "source": {
    "path": "data/curated/game_control_facts.jsonl",
    "url": "https://gamewith.net/final-fantasy-16/article/show/39644",
    "source_ids": [],
    "last_verified_at": ""
  }
}
