{
  "schema_version": 1,
  "content_id": "member_930bf12e4f38f6ff",
  "category": "members",
  "kind": "member",
  "lifecycle": {
    "status": "published",
    "version": 1
  },
  "aliases": {
    "th": [
      "นายพฤทธิ์ เกษตรสมบูรณ์"
    ],
    "en": []
  },
  "facts": {
    "group": "Members",
    "source_url": "https://esports.phuket.psu.ac.th/about-us/Members"
  },
  "locales": {
    "th": {
      "status": "source",
      "fields": {
        "name": "นายพฤทธิ์ เกษตรสมบูรณ์",
        "role": "นักวิชาการคอมพิวเตอร์",
        "affiliation": "วิทยาลัยการคอมพิวเตอร์ มหาวิทยาลัยสงขลานครินทร์ วิทยาเขตภูเก็ต"
      }
    },
    "en": {
      "status": "missing",
      "fields": {},
      "source_sha256": "47d3275b4124aa72266dd6464f76c26d37e0b94408320ecbe3c242a664157172",
      "approved_by": "",
      "approved_at": ""
    }
  },
  "source": {
    "path": "data/curated/member_profiles.jsonl",
    "url": "https://esports.phuket.psu.ac.th/about-us/Members",
    "source_ids": [],
    "last_verified_at": ""
  }
}
