{
  "schema_version": 1,
  "content_id": "curated_rule_smoking_alcohol_drugs",
  "category": "knowledge",
  "kind": "knowledge_fact",
  "lifecycle": {
    "status": "published",
    "version": 1
  },
  "aliases": {
    "th": [
      "บุหรี่ สารเสพติด และแอลกอฮอล์"
    ],
    "en": []
  },
  "facts": {
    "source_url": "https://esports.computing.psu.ac.th/",
    "tags": [
      "rules",
      "smoking",
      "alcohol",
      "บุหรี่"
    ],
    "priority": 10
  },
  "locales": {
    "th": {
      "status": "source",
      "fields": {
        "title": "บุหรี่ สารเสพติด และแอลกอฮอล์",
        "text": "ห้ามสูบบุหรี่ เสพสารเสพติด หรือดื่มเครื่องดื่มแอลกอฮอล์ภายในศูนย์"
      }
    },
    "en": {
      "status": "missing",
      "fields": {},
      "source_sha256": "035294d9cd1136d5c4957db327263c9be640eef50a7ba608de294f3d5c56c4ab",
      "approved_by": "",
      "approved_at": ""
    }
  },
  "source": {
    "path": "data/curated/curated_facts.jsonl",
    "url": "https://esports.computing.psu.ac.th/",
    "source_ids": [],
    "last_verified_at": ""
  }
}
