{
  "schema_version": 1,
  "content_id": "curated_games_pc",
  "category": "knowledge",
  "kind": "knowledge_fact",
  "lifecycle": {
    "status": "published",
    "version": 1
  },
  "aliases": {
    "th": [
      "เกมบน PC"
    ],
    "en": []
  },
  "facts": {
    "source_url": "https://esports.computing.psu.ac.th/",
    "tags": [
      "games",
      "pc"
    ],
    "priority": 9
  },
  "locales": {
    "th": {
      "status": "source",
      "fields": {
        "title": "เกมบน PC",
        "text": "เกมที่ปรากฏในรายการ PC ได้แก่ Tekken 8, Counter-Strike 2, League of Legends, PUBG: BATTLEGROUNDS, VALORANT และ Call of Duty: Warzone"
      }
    },
    "en": {
      "status": "missing",
      "fields": {},
      "source_sha256": "9783a6db0a850128eb9ac63f1fead75024b21bc06836b99f5e7b952ad417b55e",
      "approved_by": "",
      "approved_at": ""
    }
  },
  "source": {
    "path": "data/curated/curated_facts.jsonl",
    "url": "https://esports.computing.psu.ac.th/",
    "source_ids": [],
    "last_verified_at": ""
  }
}
