{
  "schema_version": 1,
  "content_id": "member_1d37816f5d904797",
  "category": "members",
  "kind": "member",
  "lifecycle": {
    "status": "published",
    "version": 1
  },
  "aliases": {
    "th": [
      "นางสาวชญาภา จันทร์เอิบ"
    ],
    "en": []
  },
  "facts": {
    "group": "PSU Phuket Esports Club - PSU Phuket",
    "source_url": "https://esports.phuket.psu.ac.th/about-us/Members"
  },
  "locales": {
    "th": {
      "status": "source",
      "fields": {
        "name": "นางสาวชญาภา จันทร์เอิบ",
        "role": "กรรมการ"
      }
    },
    "en": {
      "status": "missing",
      "fields": {},
      "source_sha256": "4fe445b15e81766e667f46aff05d26c81e1c1ba9bdc0cc8d281d1e2da722237c",
      "approved_by": "",
      "approved_at": ""
    }
  },
  "source": {
    "path": "data/curated/member_profiles.jsonl",
    "url": "https://esports.phuket.psu.ac.th/about-us/Members",
    "source_ids": [],
    "last_verified_at": ""
  }
}
