{
  "schema_version": 1,
  "content_id": "controls.ps5.the_last_of_us_part_ii",
  "category": "game_controls",
  "kind": "control_map",
  "lifecycle": {
    "status": "published",
    "version": 1
  },
  "aliases": {
    "th": [],
    "en": [
      "The Last of Us Part II"
    ]
  },
  "facts": {
    "game": "The Last of Us Part II",
    "platform": "PlayStation / PS5",
    "platform_key": "ps5",
    "coverage_status": "secondary_needs_manual_verify",
    "control_count": 15,
    "source_urls": [
      "https://gameinputdatabase.com/game/16"
    ]
  },
  "locales": {
    "th": {
      "status": "source",
      "fields": {
        "summary": "The Last of Us Part II บน PlayStation / PS5 มีข้อมูลปุ่มควบคุม 15 รายการ",
        "controls": [
          {
            "button": "L (Left Stick)",
            "buttons": [
              "L (Left Stick)"
            ],
            "action_th": "เคลื่อนที่",
            "description_th": "บังคับทิศทางการเดิน การย่อง หรือการวิ่งของตัวละครไปตามฉาก",
            "section": ""
          },
          {
            "button": "L3 (Click Left Stick)",
            "buttons": [
              "L3 (Click Left Stick)"
            ],
            "action_th": "หันมองจุดสนใจ",
            "description_th": "กดคลิกลงไปเพื่อหันมุมกล้องล็อกไปยังวัตถุ เบาะแส หรือเหตุการณ์สำคัญที่เกมต้องการให้สังเกตทันที",
            "section": ""
          },
          {
            "button": "R (Right Stick)",
            "buttons": [
              "R (Right Stick)"
            ],
            "action_th": "มุมกล้อง",
            "description_th": "หมุนอนาล็อกเพื่อหันมุมมอง กวาดสายตาดูรอบๆ ตัว หรือใช้ควบคุมทิศทางเป้าปืน",
            "section": ""
          },
          {
            "button": "R3 (Click Right Stick)",
            "buttons": [
              "R3 (Click Right Stick)"
            ],
            "action_th": "ไฟฉาย",
            "description_th": "กดคลิกลงไปตรงๆ เพื่อเปิดหรือปิดไฟฉายเมื่อต้องลุยในตึกร้างหรือพื้นที่มืดสนิท",
            "section": ""
          },
          {
            "button": "L1",
            "buttons": [
              "L1"
            ],
            "action_th": "หลบหลีก",
            "description_th": "กดในจังหวะที่ศัตรูเหวี่ยงอาวุธหรือพุ่งเข้ามาต่อย เพื่อเอี้ยวตัวหรือฉากหลบการโจมตีระยะประชิดทันที",
            "section": ""
          },
          {
            "button": "L2",
            "buttons": [
              "L2"
            ],
            "action_th": "เล็งเป้า (กดค้าง)",
            "description_th": "กดค้างไว้เพื่อยกอาวุธปืน คันธนู หรือไอเทมประเภทระเบิดขว้างขึ้นมาเตรียมพร้อมเล็งยิง",
            "section": ""
          },
          {
            "button": "R1",
            "buttons": [
              "R1"
            ],
            "action_th": "โหมดฟังเสียง (กดค้าง) / สลับอาวุธด่วน",
            "description_th": "กดค้างเพื่อเปิดโหมดฟังเสียงสแกนหาตำแหน่งศัตรูทะลุกำแพงผ่านคลื่นเสียง หรือกดแตะสั้นๆ เพื่อสลับไปใช้อาวุธก่อนหน้า",
            "section": ""
          },
          {
            "button": "R2",
            "buttons": [
              "R2"
            ],
            "action_th": "ยิงปืน (ขณะเล็ง) / รีโหลดกระสุน",
            "description_th": "เหนี่ยวไกยิง/ปล่อยลูกธนูหากกดในขณะเล็งปืนอยู่ แต่ถ้ากดตอนไม่ได้เล็งจะเป็นการบรรจุกระสุนใหม่ใส่ปืน",
            "section": ""
          },
          {
            "button": "Triangle",
            "buttons": [
              "Triangle"
            ],
            "action_th": "โต้ตอบ / สำรวจ",
            "description_th": "ใช้สำหรับเปิดประตู เก็บไอเทมวัตถุดิบตามฉาก แทรกตัวเข้าช่องแคบ หรือใช้จับศัตรูจากทางด้านหลัง",
            "section": ""
          },
          {
            "button": "Circle",
            "buttons": [
              "Circle"
            ],
            "action_th": "ย่อตัว / หมอบคลาน",
            "description_th": "กดหนึ่งครั้งเพื่อย่อตัวย่องเงียบหลบสายตา หรือกดค้างไว้เพื่อหมอบคลานไปกับพื้นราบ/พงหญ้าเพื่อซ่อนตัว",
            "section": ""
          },
          {
            "button": "Square",
            "buttons": [
              "Square"
            ],
            "action_th": "โจมตีประชิด",
            "description_th": "ออกอาวุธโจมตีระยะประชิดทันที ไม่ว่าจะเป็นการรัวหมัด ต่อย ตบ หรือหวดด้วยอาวุธมีคม/ไม้หน้าสามที่ถืออยู่",
            "section": ""
          },
          {
            "button": "Cross",
            "buttons": [
              "Cross"
            ],
            "action_th": "กระโดด",
            "description_th": "กดเพื่อกระโดดขึ้นจากพื้น ใช้สำหรับกระโดดข้ามสิ่งกีดขวาง ช่องว่างระหว่างตึก หรือปีนป่ายขึ้นที่สูง",
            "section": ""
          },
          {
            "button": "D-Pad (Up / Down / Left / Right)",
            "buttons": [
              "D-Pad (Up / Down / Left / Right)"
            ],
            "action_th": "แผงเลือกอุปกรณ์ด่วน",
            "description_th": "กดปุ่มทิศทางเพื่อเปิดหน้าต่างสลับเปลี่ยนอาวุธปืน ระเบิด หรืออุปกรณ์ต่างๆ ที่ติดตั้งไว้ในช่องทางลัด",
            "section": ""
          },
          {
            "button": "Touch Pad",
            "buttons": [
              "Touch Pad"
            ],
            "action_th": "สัมภาระ / เมนูกระเป๋าเก็บของ",
            "description_th": "เปิดหน้าต่างกระเป๋าหลังเพื่อเข้าไปดูไอเทมทั้งหมด ผสมของ (คราฟต์ไอเทม) และกดใช้แต้มอัปเกรดสกิลตัวละคร",
            "section": ""
          },
          {
            "button": "Options",
            "buttons": [
              "Options"
            ],
            "action_th": "หยุดเกม",
            "description_th": "หยุดหน้าจอเกมชั่วคราวเพื่อเข้าสู่เมนูระบบ ดูสถิติ หรือปรับแต่งการตั้งค่า",
            "section": ""
          }
        ]
      }
    },
    "en": {
      "status": "legacy_unreviewed",
      "fields": {
        "controls": [
          {
            "button": "L (Left Stick)",
            "action": "Move"
          },
          {
            "button": "L3 (Click Left Stick)",
            "action": "Look at"
          },
          {
            "button": "R (Right Stick)",
            "action": "Camera"
          },
          {
            "button": "R3 (Click Right Stick)",
            "action": "Flashlight"
          },
          {
            "button": "L1",
            "action": "Dodge"
          },
          {
            "button": "L2",
            "action": "Aim (Hold)"
          },
          {
            "button": "R1",
            "action": "Listen mode (Hold) / Switch Weapon"
          },
          {
            "button": "R2",
            "action": "Shoot (While aiming) / Reload"
          },
          {
            "button": "Triangle",
            "action": "Interact"
          },
          {
            "button": "Circle",
            "action": "Crouch"
          },
          {
            "button": "Square",
            "action": "Melee"
          },
          {
            "button": "Cross",
            "action": "Jump"
          },
          {
            "button": "D-Pad (Up / Down / Left / Right)",
            "action": "Tool selection (Up / Down / Left / Right)"
          },
          {
            "button": "Touch Pad",
            "action": "Inventory"
          },
          {
            "button": "Options",
            "action": "Pause"
          }
        ]
      },
      "source_sha256": "10a5a0ef50494c79bd43f7e7be76f9e503d41331b54a8b2970c6b5431734eeb9",
      "approved_by": "",
      "approved_at": ""
    }
  },
  "source": {
    "path": "data/curated/game_control_facts.jsonl",
    "url": "https://gameinputdatabase.com/game/16",
    "source_ids": [],
    "last_verified_at": ""
  }
}
