{
  "schema_version": 1,
  "content_id": "game_detail_switch_sports",
  "category": "games",
  "kind": "game_profile",
  "lifecycle": {
    "status": "published",
    "version": 1
  },
  "aliases": {
    "th": [],
    "en": [
      "nintendo switch sports",
      "switch sports",
      "Nintendo Switch Sports"
    ]
  },
  "facts": {
    "text": "Nintendo Switch Sports: Nintendo Switch Sports คือเกมกีฬาที่ใช้การขยับ Joy-Con จำลองการเล่นกีฬาหลายประเภท\nแนวเกม: เกมกีฬา Motion Control\nวิธีเล่นโดยสรุป: ถือ Joy-Con แล้วขยับตามกีฬาที่เลือก เช่น ตี โยน หรือแกว่งตามท่าทางในเกม\nเล่นได้ที่: Nintendo Switch Zone",
    "game": "Nintendo Switch Sports",
    "zones": [
      "Nintendo Switch Zone"
    ],
    "tags": [
      "games",
      "game_detail",
      "switch_sports",
      "Nintendo Switch Sports",
      "nintendo switch sports",
      "switch sports"
    ],
    "source_url": "https://esports.phuket.psu.ac.th/Services/our-games",
    "priority": 20
  },
  "locales": {
    "th": {
      "status": "source",
      "fields": {
        "title": "Nintendo Switch Sports",
        "summary_th": "Nintendo Switch Sports คือเกมกีฬาที่ใช้การขยับ Joy-Con จำลองการเล่นกีฬาหลายประเภท",
        "how_to_play_th": "ถือ Joy-Con แล้วขยับตามกีฬาที่เลือก เช่น ตี โยน หรือแกว่งตามท่าทางในเกม",
        "genre": "เกมกีฬา Motion Control"
      }
    },
    "en": {
      "status": "missing",
      "fields": {},
      "source_sha256": "3e59985811cfeb84cc575f821ae8ff6a2bc099d7b41ce62078b0cb0a2130d35a",
      "approved_by": "",
      "approved_at": ""
    }
  },
  "source": {
    "path": "data/curated/game_item_details.jsonl",
    "url": "https://esports.phuket.psu.ac.th/Services/our-games",
    "source_ids": [],
    "last_verified_at": ""
  }
}
