{
  "schema_version": 1,
  "content_id": "equipment_racezone_cockpit_v3",
  "category": "resources",
  "kind": "equipment",
  "lifecycle": {
    "status": "published",
    "version": 1
  },
  "aliases": {
    "th": [],
    "en": [
      "Racezone Full Cockpit V3"
    ]
  },
  "facts": {
    "zone": "Cockpit Zone",
    "quantity": "2 Units",
    "source_url": "https://esports.phuket.psu.ac.th/home"
  },
  "locales": {
    "th": {
      "status": "source",
      "fields": {
        "item": "Racezone Full Cockpit V3",
        "what_th": "ชุดเบาะและโครงจำลองการขับรถสำหรับเกมแข่งรถ",
        "how_to_use_th": "นั่งใน Cockpit แล้วใช้พวงมาลัย คันเร่ง และเบรกตามที่ตั้งค่าไว้ในเกม",
        "use_cases_th": [
          "เล่น Gran Turismo 7 แบบจำลองการขับจริงมากขึ้น"
        ]
      }
    },
    "en": {
      "status": "missing",
      "fields": {},
      "source_sha256": "43f12f04fa04c29958201857591b43739ee6a2816d3d37662ee25d583c13c4d7",
      "approved_by": "",
      "approved_at": ""
    }
  },
  "source": {
    "path": "data/curated/equipment_item_details.jsonl",
    "url": "https://esports.phuket.psu.ac.th/home",
    "source_ids": [],
    "last_verified_at": ""
  }
}
