{
  "schema_version": 1,
  "content_id": "controls.nintendo.mario_kart_live_home_circuit",
  "category": "game_controls",
  "kind": "control_map",
  "lifecycle": {
    "status": "published",
    "version": 1
  },
  "aliases": {
    "th": [
      "มาริโอคาร์ทไลฟ์",
      "มาริโอ้คาร์ทไลฟ์",
      "มาริโอคาทไลฟ์",
      "มาริโอคาร์ทไลฟ์โฮมเซอร์กิต",
      "มาริโอ้คาร์ทไลฟ์โฮมเซอร์กิต",
      "มาริโอคาร์ทโฮมเซอร์กิต",
      "มาริโอ้คาร์ทโฮมเซอร์กิต",
      "มาริโอคาร์ทไลฟ์โฮม",
      "มาริโอไลฟ์โฮมเซอร์กิต"
    ],
    "en": [
      "Mario Kart Live: Home Circuit",
      "Mario Kart Live",
      "MK Live",
      "Home Circuit"
    ]
  },
  "facts": {
    "game": "Mario Kart Live: Home Circuit",
    "platform": "Nintendo Switch",
    "platform_key": "nintendo",
    "coverage_status": "secondary_needs_manual_verify",
    "control_count": 11,
    "source_urls": [
      "https://kotaku.com/mario-kart-live-home-circuit-the-kotaku-review-1845365233",
      "https://en-americas-support.nintendo.com/app/answers/detail/a_id/50494/~/mario-kart-live%3A-home-circuit-faq"
    ]
  },
  "locales": {
    "th": {
      "status": "source",
      "fields": {
        "summary": "Mario Kart Live: Home Circuit บน Nintendo Switch มีข้อมูลปุ่มควบคุม 11 รายการ",
        "controls": [
          {
            "button": "Left Stick",
            "buttons": [
              "Left Stick"
            ],
            "action_th": "เลี้ยว",
            "description_th": "บังคับพวงมาลัยรถคาร์ทซ้ายหรือขวา",
            "section": "Driving Controls"
          },
          {
            "button": "A",
            "buttons": [
              "A"
            ],
            "action_th": "เร่งเครื่อง",
            "description_th": "กดค้างเพื่อเร่งความเร็วรถไปข้างหน้า",
            "section": "Driving Controls"
          },
          {
            "button": "B",
            "buttons": [
              "B"
            ],
            "action_th": "เบรก / ถอยหลัง",
            "description_th": "ชะลอรถ หรือกดค้างเพื่อถอยหลัง",
            "section": "Driving Controls"
          },
          {
            "button": "L",
            "buttons": [
              "L"
            ],
            "action_th": "ใช้ไอเทม",
            "description_th": "ใช้งานไอเทมที่เก็บได้ระหว่างแข่ง",
            "section": "Driving Controls"
          },
          {
            "button": "R",
            "buttons": [
              "R"
            ],
            "action_th": "ดริฟต์",
            "description_th": "กดค้างขณะเลี้ยวเพื่อดริฟต์เข้าโค้ง",
            "section": "Driving Controls"
          },
          {
            "button": "X",
            "buttons": [
              "X"
            ],
            "action_th": "บีบแตร",
            "description_th": "บีบแตรส่งเสียงในเกม",
            "section": "Driving Controls"
          },
          {
            "button": "X",
            "buttons": [
              "X"
            ],
            "action_th": "ปรับความเร็ว (cc)",
            "description_th": "",
            "section": "Pause Menu Shortcuts"
          },
          {
            "button": "L",
            "buttons": [
              "L"
            ],
            "action_th": "เปลี่ยนสภาพแวดล้อมสนาม",
            "description_th": "",
            "section": "Pause Menu Shortcuts"
          },
          {
            "button": "Y",
            "buttons": [
              "Y"
            ],
            "action_th": "เปิด/ปิดระบบช่วยขับ",
            "description_th": "",
            "section": "Pause Menu Shortcuts"
          },
          {
            "button": "R",
            "buttons": [
              "R"
            ],
            "action_th": "จัดการแผนที่",
            "description_th": "",
            "section": "Pause Menu Shortcuts"
          },
          {
            "button": "D-Pad",
            "buttons": [
              "D-Pad"
            ],
            "action_th": "ดูใบขับขี่และสถิติ",
            "description_th": "",
            "section": "Pause Menu Shortcuts"
          }
        ]
      }
    },
    "en": {
      "status": "legacy_unreviewed",
      "fields": {
        "controls": [
          {
            "button": "Left Stick",
            "action": "Steer"
          },
          {
            "button": "A",
            "action": "Accelerate"
          },
          {
            "button": "B",
            "action": "Brake/Reverse"
          },
          {
            "button": "L",
            "action": "Use Item"
          },
          {
            "button": "R",
            "action": "Drift"
          },
          {
            "button": "X",
            "action": "Horn"
          },
          {
            "button": "X",
            "action": "Speed"
          },
          {
            "button": "L",
            "action": "Environment"
          },
          {
            "button": "Y",
            "action": "Assist"
          },
          {
            "button": "R",
            "action": "Map"
          },
          {
            "button": "D-Pad",
            "action": "License"
          }
        ]
      },
      "source_sha256": "cf885d61fca0d8ec7508ba60bf95ddf9ed7aa0021b7c9c62eb5de7f3fb7abe6c",
      "approved_by": "",
      "approved_at": ""
    }
  },
  "source": {
    "path": "data/curated/game_control_facts.jsonl",
    "url": "https://kotaku.com/mario-kart-live-home-circuit-the-kotaku-review-1845365233",
    "source_ids": [],
    "last_verified_at": ""
  }
}
