{
  "schema_version": 1,
  "content_id": "curated_rule_noise_language",
  "category": "knowledge",
  "kind": "knowledge_fact",
  "lifecycle": {
    "status": "published",
    "version": 1
  },
  "aliases": {
    "th": [
      "เสียงดังและคำพูดไม่เหมาะสม"
    ],
    "en": []
  },
  "facts": {
    "source_url": "https://esports.computing.psu.ac.th/",
    "tags": [
      "rules",
      "noise",
      "language"
    ],
    "priority": 9
  },
  "locales": {
    "th": {
      "status": "source",
      "fields": {
        "title": "เสียงดังและคำพูดไม่เหมาะสม",
        "text": "กรุณางดส่งเสียงดังเกินควร และห้ามพูดจาดูหมิ่นหรือเสียดสีผู้อื่น"
      }
    },
    "en": {
      "status": "missing",
      "fields": {},
      "source_sha256": "37f6f081904549780ee39c33dd9a32229d552332fe94b5ed2874cd256e81876a",
      "approved_by": "",
      "approved_at": ""
    }
  },
  "source": {
    "path": "data/curated/curated_facts.jsonl",
    "url": "https://esports.computing.psu.ac.th/",
    "source_ids": [],
    "last_verified_at": ""
  }
}
